{
  "title": "Grundlagen der Algebra: Lineare Gleichungen",
  "topic": "Algebra",
  "points_total": 5,
  "question": "Welche Lösung hat die Gleichung 3x + 5 = 20?",
  "options": [
    {
      "id": "A",
      "text": "x = 5",
      "correct": true
    },
    {
      "id": "B",
      "text": "x = 15",
      "correct": false
    },
    {
      "id": "C",
      "text": "x = 2",
      "correct": false
    },
    {
      "id": "D",
      "text": "x = 10",
      "correct": false
    }
  ],
  "explanation": "Durch Subtraktion von 5 und Division durch 3 ergibt sich x = 5."
}