{
  "title": "Evolution: Anpassung von Lebewesen",
  "topic": "Biologie",
  "points_total": 1,
  "question": "Welcher Prozess beschreibt die Anpassung von Lebewesen an ihre Umwelt über Generationen?",
  "options": [
    {
      "id": "A",
      "text": "Mutation",
      "correct": false
    },
    {
      "id": "B",
      "text": "Selektion",
      "correct": true
    },
    {
      "id": "C",
      "text": "Vererbung",
      "correct": false
    },
    {
      "id": "D",
      "text": "Reproduktion",
      "correct": false
    }
  ],
  "explanation": "Selektion beschreibt, wie sich Lebewesen mit vorteilhaften Merkmalen fortpflanzen und diese an die nächste Generation weitergeben."
}