{
  "title": "Datenbankkonzepte: Schemata und Ansichten",
  "topic": "Datenbanken",
  "points_total": 2,
  "question": "Welches Schema zeigt die logische Struktur einer Datenbank aus Sicht der Benutzer?",
  "options": [
    {
      "id": "A",
      "text": "Externes Schema",
      "correct": true
    },
    {
      "id": "B",
      "text": "Internes Schema",
      "correct": false
    },
    {
      "id": "C",
      "text": "Konzeptuelles Schema",
      "correct": false
    },
    {
      "id": "D",
      "text": "Visuelles Schema",
      "correct": false
    }
  ],
  "explanation": "Das externe Schema definiert die logische Sicht auf die Datenbank für verschiedene Benutzergruppen."
}