{
  "title": "Transaktionen in PostgreSQL mit pgAdmin",
  "topic": "Datenbanken",
  "points_total": 5,
  "question": "Welcher Befehl startet eine explizite Transaktion in PostgreSQL?",
  "options": [
    {
      "id": "A",
      "text": "BEGIN TRANSACTION",
      "correct": true
    },
    {
      "id": "B",
      "text": "START TRANSACTION",
      "correct": false
    },
    {
      "id": "C",
      "text": "COMMIT TRANSACTION",
      "correct": false
    },
    {
      "id": "D",
      "text": "ROLLBACK TRANSACTION",
      "correct": false
    }
  ],
  "explanation": "BEGIN TRANSACTION ist der korrekte Befehl, um eine Transaktion in PostgreSQL zu starten."
}