{
  "title": "Tiefster Punkt der Welt",
  "topic": "Geographie",
  "points_total": 1,
  "question": "Welcher Punkt ist der tiefste Ort der Welt?",
  "options": [
    {
      "id": "A",
      "text": "Mariana-Graben",
      "correct": true
    },
    {
      "id": "B",
      "text": "Totes Meer",
      "correct": false
    },
    {
      "id": "C",
      "text": "Dead Sea",
      "correct": false
    },
    {
      "id": "D",
      "text": "Challenger Deep",
      "correct": false
    }
  ],
  "explanation": "Der tiefste Punkt der Welt ist der Mariana-Graben."
}